{
  "graph_id": "declared-c1",
  "graph_kind": "DECLARED",
  "commit": "318511d7bbe5ea779799835f4bc40ec2b340259a",
  "configuration_id": "cc-MODE0",
  "nodes": [
    "app",
    "config.h",
    "main.c",
    "main.o"
  ],
  "edges": [
    {
      "source": "app",
      "target": "main.o",
      "evidence": "Makefile:4:app:main.o"
    },
    {
      "source": "main.o",
      "target": "config.h",
      "evidence": "Makefile:7:main.o:config.h"
    },
    {
      "source": "main.o",
      "target": "main.c",
      "evidence": "Makefile:7:main.o:main.c"
    }
  ],
  "provenance": "REAL_TOOL_OUTPUT"
}
