{
  "graph_id": "actual-md-rd",
  "graph_kind": "ACTUAL",
  "commit": "fixture-md-rd",
  "configuration_id": "cc-MODE0",
  "nodes": [
    "app",
    "config.h",
    "main.c",
    "main.o"
  ],
  "edges": [
    {
      "source": "app",
      "target": "main.o",
      "evidence": "build:app:link:main.o"
    },
    {
      "source": "main.o",
      "target": "config.h",
      "evidence": "source:main.c:include:config.h:line:2"
    },
    {
      "source": "main.o",
      "target": "main.c",
      "evidence": "build:main.o:source:main.c"
    }
  ],
  "provenance": "REAL_TOOL_OUTPUT"
}
